{
  "schema_version": "1.0.0",
  "run_id": "20261009T081500Z_elbow_s42",
  "stage": "elbow",
  "seed": 42,
  "status": "running",
  "timestamp_utc": "2026-10-09T08:15:10Z",
  "update_idx": 3,
  "env_steps": 6144,
  "total_steps": 100000,
  "env_steps_per_second": 1480.5,
  "mean_return": -48.2,
  "loss": {"policy": -0.012, "value": 35.4, "entropy": 4.1},
  "activation": {"muscle_names": ["TRIlong", "TRIlat", "TRImed", "BIClong", "BICshort", "BRA"], "mean": [0.31, 0.29, 0.3, 0.52, 0.5, 0.48]},
  "checkpoint": {"count": 0, "every_updates": 10, "last_path": null, "last_update_idx": null},
  "history": {"env_steps": [2048, 4096, 6144], "mean_return": [-52.1, -50.7, -48.2], "value_loss": [41.0, 38.2, 35.4]}
}
