{
  "schema_version": "1.0.0",
  "run_id": "20261009T081500Z_elbow_s42",
  "stage": "elbow",
  "seed": 42,
  "status": "starting",
  "timestamp_utc": "2026-10-09T08:15:01Z",
  "update_idx": 0,
  "env_steps": 0,
  "total_steps": 100000,
  "env_steps_per_second": null,
  "mean_return": null,
  "loss": null,
  "activation": null,
  "checkpoint": {"count": 0, "every_updates": 10, "last_path": null, "last_update_idx": null},
  "history": {"env_steps": [], "mean_return": [], "value_loss": []}
}
